hotel_id,hotel_name,hotel_rating,hotel_experience,amenities,address,city,country,location,hotel_price
627,Om Desert Resort,4.2,Wonderful,"['Parking included', 'Breakfast included', 'Restaurant', 'Room service', 'Housekeeping', '24/7 front desk']","Lakhmana Road, Opp. Sam Sand Dunes, Jaisalmer, Rajasthan, 345001",Jaisalmer,India,"26.854857, 70.54298",68.0
628,Deoki Niwas Palace,3.8,Very Good,"['Free WiFi', 'Air conditioning', 'Parking included', 'Pool', 'Restaurant', 'Bar']","Jethwai Rd, Jaisalmer, RJ, 345001",Jaisalmer,India,"26.916206, 70.921418",55.0
629,Mohin Desert Safari Camp,4.5,Wonderful,"['Free WiFi', 'Parking included', 'Laundry', 'Restaurant', 'Bar', 'Room service']","Near Parking Sam Sand Dune, Jaisalmer, Rajasthan, 345001",Jaisalmer,India,"26.853604, 70.550665",38.0
630,Desert Holiday Camp,4.1,Wonderful,"['Free WiFi', 'Air conditioning', 'Parking included', 'Laundry', 'Pet friendly', 'Restaurant']","Sam Sand Dunes, Jaisalmer, RJ, 345001",Jaisalmer,India,"26.834121, 70.533507",51.0
631,Boutique Helsinki,4.8,Exceptional,"['Free WiFi', 'Air conditioning', 'Parking included', 'Laundry', 'Pet friendly', 'Restaurant']","Bera Road, Opposite - Pushkarna Bera, Jaisalmer, 345001",Jaisalmer,India,"26.90353, 70.91256",63.0
632,Seven Palms Desert Camp,4.5,Wonderful,"['Free WiFi', 'Parking included', 'Breakfast included', 'Restaurant', 'Housekeeping', '24/7 front desk']","Sam Sand Dunes, Near Sam Toll Beriar, Right Side on Road, Sam Desert, Jaisalmer, Rajasthan, 345001",Jaisalmer,India,"26.866424, 70.566727",37.0
633,Hotel Prince,3.6,Very Good,"['Free airport shuttle', 'Free WiFi', 'Parking included', 'Laundry', 'Restaurant', 'Breakfast available']","Near Bhatia Bagechi, Hanuman Circle, Jaisalmer, 345001",Jaisalmer,India,"26.91661, 70.90806",65.0
634,Hotel Hayyat,4.6,Exceptional,"['Free WiFi', 'Air conditioning', 'Parking included', 'Breakfast included', 'Laundry', 'Restaurant']","Near Tourist Reception Centre, Jaisalmer, 345001",Jaisalmer,India,"26.91032, 70.91788",68.0
635,Ozaki Desert Safari Camp Jaisalmer,3.6,Very Good,"['Parking included', 'Breakfast included', 'Laundry', 'Restaurant', 'Bar', 'Housekeeping']","Sam Sand Dunes Sam Jaisalmer, Jaisalmer, RJ, 345001",Jaisalmer,India,"26.830453, 70.507157",33.0
636,Hotel Renuka,4.3,Wonderful,"['Free WiFi', 'Laundry', 'Restaurant', 'Breakfast available', 'Business services', 'Room service']","North Of Gandhi Chowk Road, Chainpura Para, Jaisalmer, Rajasthan, 345001",Jaisalmer,India,"26.917429, 70.911168",66.0
637,ADB Rooms Jaisalmer Dunes Camp,4.5,Wonderful,"['Parking included', 'Laundry', 'Outdoor Space', 'Restaurant', 'Housekeeping']","Sam, 7 Km Mile Stone, Jaisalmer, Rajasthan, 345001",Jaisalmer,India,"26.856446, 70.554216",32.0
638,Hotel Oasis Haveli,3.6,Good,"['Free WiFi', 'Air conditioning', 'Parking included', 'Breakfast included', 'Laundry', 'Kitchen']","Near State Bank of Bikaner Jaipur Bank, Shiv Road, Sadar Bazaar, Jaisalmer, Rajasthan, 345001",Jaisalmer,India,"26.912738, 70.91064",60.0
639,Rajputana Desert Camp,4.0,Very Good,"['Free WiFi', 'Parking included', 'Breakfast included', 'Pet friendly', 'Restaurant', 'Room service']","Kuldhara Road, next to Sam Dunes, Jaisalmer, Rajasthan, 345001",Jaisalmer,India,"26.91459, 70.90091",24.0
640,hotel apollo jaisalmer,4.4,Wonderful,"['Free WiFi', 'Parking included', 'Laundry', 'Breakfast available', 'Room service', '24/7 front desk']","opp- sbi bank, dhibba para, Jaisalmer, rajasthan, 345001",Jaisalmer,India,"26.90975, 70.9167",70.0
641,fotiya hotel,4.8,Exceptional,"['Free WiFi', 'Parking included', 'Pet friendly', 'Restaurant', 'Breakfast available', 'Room service']","K.l anchalvanshi colony, dedansar road, Malka Pol, Jaisalmer, RJ, 345001",Jaisalmer,India,"26.92087, 70.90971",70.0
642,Rajputana Desert Camp,4.4,Wonderful,"['Free airport shuttle', 'Parking included', 'Breakfast included', 'Restaurant', 'Room service', 'Housekeeping']","Kuldhara Road, next to Sam Dunes, Jaisalmer, Rajasthan, 345001",Jaisalmer,India,"26.841756, 70.545735",19.0
643,The Golden House,4.4,Excellent,"['Free WiFi', 'Air conditioning', 'Parking included', 'Laundry', 'Pet friendly', 'Restaurant']","28 Chandra Veer Singh, Opp. Collectorate, Jaisalmer, Rajasthan, 345001",Jaisalmer,India,"26.916503, 70.905649",20.0
644,V Resorts Desert Pride Jaisalmer,4.5,Wonderful,"['Free WiFi', 'Parking included', 'Laundry', 'Restaurant', 'Room service', 'Housekeeping']","Dhibba Para, Near Fort Parking, Jaisalmer, 345001",Jaisalmer,India,"26.91165, 70.91477",17.0
645,The Mamas Resort and Camp,5.0,Exceptional,"['Free WiFi', 'Parking included', 'Breakfast included', 'Laundry', 'Pool', 'Restaurant']","Village Khuri, Jaisalmer, Jaisalmer, Rajasthan, 345001",Jaisalmer,India,"26.618675, 70.707896",20.0
646,Atulya Garh Marwar,3.5,Good,"['Parking included', 'Breakfast included', 'Restaurant', 'Housekeeping', '24/7 front desk']","VPO Village Jaisalmer, Khuri Main Road, Jaisalmer, Rajasthan, 345001",Jaisalmer,India,"26.6681, 70.693624",54.0
647,Atulya garh marwar,4.0,Very Good,"['Free WiFi', 'Parking included', 'Breakfast included', 'Restaurant', 'Room service', 'Housekeeping']","Khuri, Jaisalmer, Rajasthan, 315401",Jaisalmer,India,"26.619534, 70.707343",21.0
648,Gangaur Desert Resort Khuri,4.5,Wonderful,"['Free WiFi', 'Air conditioning', 'Parking included', 'Breakfast included', 'Laundry', 'Restaurant']","Janra Road, Khuri, Jaisalmer, Jaisalmer, Rajasthan, 345001",Jaisalmer,India,"26.609401, 70.745846",41.0
649,Registhan Guest House,3.8,Good,"['Free WiFi', 'Parking included', 'Laundry', 'Restaurant', 'Room service', 'Housekeeping']","Village Dhoba, Jaisalmer, Rajasthan, 345001",Jaisalmer,India,"26.611023, 70.714359",15.0
650,rajwadi desert camp,3.9,Very Good,"['Free WiFi', 'Parking included', 'Breakfast included', 'Kitchen', 'Outdoor Space', 'Restaurant']","Opp Sam Sand Dunes, Jaisalmer, Rajasthan, 345001",Jaisalmer,India,"26.614802, 70.710557",17.0
651,Pansari Resort & Camp,4.1,Wonderful,"['Free WiFi', 'Laundry', 'Pet friendly', 'Restaurant', 'Business services', 'Housekeeping']","Khuri, Jaisalmer, Rajasthan, 345034",Jaisalmer,India,"26.614811, 70.716087",65.0
652,"ITC Rajputana, A Luxury Collection Hotel, Jaipur",4.4,Excellent,"['Air conditioning', 'Spa', 'Free WiFi', 'Parking included', 'Laundry', 'Pet friendly']","Palace Road Rajasthan, Jaipur, Rajasthan, 302006",Jodhpur,India,"26.918753, 75.791663",84.0
653,Jaipur Marriott Hotel,4.4,Excellent,"['Hot Tub', 'Air conditioning', 'Spa', 'Free WiFi', 'Parking included', 'Laundry']","Ashram Marg Near Jawahar Circle, Tonk Road, Jaipur, Rajasthan, 302015",Jodhpur,India,"26.840895, 75.796167",112.0
654,Hilton Jaipur,4.3,Excellent,"['Air conditioning', 'Spa', 'Free WiFi', 'Parking included', 'Laundry', 'Pool']","42 Geejgarh House Hawa Sadak, Jaipur, Rajasthan, 302006",Jodhpur,India,"26.901508, 75.783514",91.0
655,"Trident, Jaipur",4.4,Excellent,"['Air conditioning', 'Spa', 'Free WiFi', 'Parking included', 'Laundry', 'Pool']","Amber Fort Road Opposite Jal, Jaipur, Rajasthan, 302002",Jodhpur,India,"26.956677, 75.843231",83.0
656,The Oberoi Rajvilas,4.8,Exceptional,"['Air conditioning', 'Spa', 'Free WiFi', 'Parking included', 'Laundry', 'Pool']","Goner Road, Jaipur, Rajasthan, 303012",Jodhpur,India,"26.876067, 75.882354",381.0
657,Umaid Bhawan - A Heritage Style Boutique Hotel,4.3,Excellent,"['Air conditioning', 'Breakfast included', 'Free WiFi', 'Parking included', 'Laundry', 'Pool']","Behari Marg, Bank Road, bani Park, Jaipur, Rajasthan, 302016",Jodhpur,India,"26.92844, 75.79236",51.0
658,Radisson Jaipur City Center,4.0,Very Good,"['Hot Tub', 'Air conditioning', 'Spa', 'Free WiFi', 'Parking included', 'Laundry']","Khasa Kothi Circle, M.I. Road, Jaipur, Rajasthan, 302001",Jodhpur,India,"26.920224, 75.794316",64.0
659,Umaid Mahal - A Heritage Style Boutique Hotel,4.3,Excellent,"['Air conditioning', 'Free WiFi', 'Parking included', 'Laundry', 'Pool', 'Restaurant']","C-20/B2 Behari Marg Bani Park, Jaipur, Rajasthan, 302016",Jodhpur,India,"26.927879, 75.78891",40.0
660,"Four Points by Sheraton Jaipur, City Square",4.0,Very Good,"['Air conditioning', 'Spa', 'Free WiFi', 'Parking included', 'Laundry', 'Pool']","City Square, Vasundhara Colony, Tonk Road, Jaipur, Rajasthan, 302018",Jodhpur,India,"26.863574, 75.796034",94.0
661,"Devi Ratn, Jaipur -IHCL SeleQtions",4.7,Exceptional,"['Air conditioning', 'Free WiFi', 'Parking included', 'Laundry', 'Pet friendly', 'Pool']","Jamdoli, Agra Road, Tehsil Ballupura, Jaipur, Rajasthan, 302031",Jodhpur,India,"26.916746, 75.880932",160.0
662,5 BY OYO METROPOLITAN,4.1,Very Good,"['Air conditioning', 'Spa', 'Free WiFi', 'Parking included', 'Laundry', 'Pool']","Near Nehru Sehkar Bhawan, C Scheme, Jaipur, RJ, 302007",Jodhpur,India,"26.902057, 75.793617",153.0
663,Radisson Blu Jaipur,3.8,Good,"['Air conditioning', 'Spa', 'Free WiFi', 'Parking included', 'Laundry', 'Pool']","Plot No 5 & 6 Airport Plaza, Tonk Road, Jaipur, Rajasthan, 302018",Jodhpur,India,"26.842498, 75.793736",94.0
664,"Crowne Plaza Jaipur Tonk Road, an IHG Hotel",4.4,Excellent,"['Air conditioning', 'Spa', 'Free WiFi', 'Parking included', 'Laundry', 'Pool']","SP1, Sitapura (RIICO), Tonk Road, Jaipur, Rajasthan, 302022",Jodhpur,India,"26.779667, 75.827339",99.0
665,Indana Palace Jaipur,4.5,Wonderful,"['Air conditioning', 'Spa', 'Free WiFi', 'Parking included', 'Laundry', 'Pool']","Kukas, Jaipur Delhi Highway, Jaipur, Rajasthan, 302028",Jodhpur,India,"27.028725, 75.808142",93.0
666,Royal Heritage Haveli,4.4,Excellent,"['Air conditioning', 'Spa', 'Breakfast included', 'Free WiFi', 'Parking included', 'Laundry']","Khatipura Tiraya, Khatipura Road, Jaipur, Rajasthan, 302012",Jodhpur,India,"26.925373, 75.745785",146.0
667,Umaid Haveli Hotel & Resorts,3.8,Good,"['Air conditioning', 'Spa', 'Breakfast included', 'Free WiFi', 'Parking included', 'Laundry']","CP-5 RIICO Kukas, Amer, Rajasthan, 302028",Jodhpur,India,"27.029656, 75.89593",51.0
668,Narain Niwas Palace,4.8,Exceptional,"['Air conditioning', 'Spa', 'Free WiFi', 'Parking included', 'Laundry', 'Pool']","J-5, Narayan Singh Road, Jaipur, RJ, 302004",Jodhpur,India,"26.899523, 75.813088",113.0
669,Pearl Palace Heritage,4.8,Exceptional,"['Air conditioning', 'Free WiFi', 'Parking included', 'Laundry', 'Breakfast available', 'Room service']","54 , Gopal Bari, Jaipur, RJ, 302001",Jodhpur,India,"26.91593, 75.79243",39.0
670,Ramada by Wyndham Jaipur,4.0,Very Good,"['Air conditioning', 'Spa', 'Free WiFi', 'Parking included', 'Laundry', 'Pool']","Govind Marg Raja Park, Jaipur, Rajasthan, 302004",Jodhpur,India,"26.896044, 75.829106",339.0
671,Hotel 360,4.0,Very Good,"['Air conditioning', 'Free WiFi', 'Parking included', 'Laundry', 'Restaurant', 'Breakfast available']","8th Floor, Anukampa Plaza, Nr Rajmandir, Bhagwandas Road, C Scheme, Jaipur, Rajasthan, 302001",Jodhpur,India,"26.914525, 75.809592",27.0
672,"Tree of Life Chhota Mahal, Amer, Jaipur",4.7,Exceptional,"['Air conditioning', 'Free WiFi', 'Parking included', 'Pet friendly', 'Pool', 'Restaurant']","BARA BUNGALOW AMER, KAMAL BAGH, Amer, Amer, Rajasthan, 302028",Jodhpur,India,"27.014391, 75.892709",96.0
673,Vesta International,3.5,Good,"['Air conditioning', 'Free WiFi', 'Parking included', 'Laundry', 'Pool', 'Restaurant']","S-3, Linking Road, Near Ajmer Pulia, Gopalbadi, Jaipur, Rajasthan, 302001",Jodhpur,India,"26.914604, 75.790847",26.0
674,Hotel Triveni Residency,4.6,Exceptional,"['Air conditioning', 'Free WiFi', 'Parking included', 'Laundry', 'Breakfast available', 'Housekeeping']","Plot No 1, Satya Vihar Colony, Near Vidhansabha, Lalkothi, Jaipur, Rajasthan, 302015",Jodhpur,India,"26.892026, 75.800203",30.0
675,Hotel Empire Regency,4.8,Exceptional,"['Free WiFi', 'Parking included', 'Pool', 'Restaurant', 'Breakfast available', 'Business services']","D-1, Madho Singh Road, Nr. Collectorate Circle, Banipark, Jaipur, Rajasthan, 302016",Jodhpur,India,"26.928404, 75.793246",33.0
676,The Fern Residency Jaipur,3.9,Good,"['Air conditioning', 'Free WiFi', 'Parking included', 'Laundry', 'Pool', 'Restaurant']","A - 13, Govind Marg, Janata Marg, Near Pink Square Mall, Jaipur, Rajasthan, 302004",Jodhpur,India,"26.90353, 75.83707",56.0
677,Dera Rawatsar - Heritage Hotel,4.6,Wonderful,"['Free airport shuttle', 'Air conditioning', 'Breakfast included', 'Free WiFi', 'Parking included', 'Laundry']","D-194/C, Vijay Path, Bani Park, Jaipur, Rajasthan, 302016",Jodhpur,India,"26.925349, 75.800807",40.0
678,"ITC Rajputana, A Luxury Collection Hotel, Jaipur",4.4,Excellent,"['Air conditioning', 'Spa', 'Free WiFi', 'Parking included', 'Laundry', 'Pet friendly']","Palace Road Rajasthan, Jaipur, Rajasthan, 302006",Jodhpur,India,"26.918753, 75.791663",84.0
679,Jaipur Marriott Hotel,4.4,Excellent,"['Hot Tub', 'Air conditioning', 'Spa', 'Free WiFi', 'Parking included', 'Laundry']","Ashram Marg Near Jawahar Circle, Tonk Road, Jaipur, Rajasthan, 302015",Jodhpur,India,"26.840895, 75.796167",112.0
680,Ramada by Wyndham Jaipur North,3.7,Very Good,"['Air conditioning', 'Breakfast included', 'Free WiFi', 'Parking included', 'Pool', 'Restaurant']","A-2/3/11/12, Metal Colony Sikar Road, Opposite Bhawani Niketan School, Jaipur, RJ, 302023",Jodhpur,India,"26.947762, 75.77337",80.0
681,"Crowne Plaza Jaipur Tonk Road, an IHG Hotel",4.4,Excellent,"['Air conditioning', 'Spa', 'Free WiFi', 'Parking included', 'Laundry', 'Pool']","SP1, Sitapura (RIICO), Tonk Road, Jaipur, Rajasthan, 302022",Jodhpur,India,"26.779667, 75.827339",99.0
682,Zone by The Park Bani Park Jaipur,4.0,Very Good,"['Air conditioning', 'Spa', 'Free WiFi', 'Parking included', 'Laundry', 'Restaurant']","Madhosingh Road, Bani Park, Jaipur, Rajasthan, 302016",Jodhpur,India,"26.933869, 75.794125",47.0
683,Barwara Kothi,4.6,Wonderful,"['Air conditioning', 'Free WiFi', 'Parking included', 'Laundry', 'Restaurant', 'Breakfast available']","5, Jacob Road, Civil Lines, Jaipur, Rajasthan, 302006",Jodhpur,India,"26.911709, 75.787926",48.0
684,Hilton Jaipur,4.3,Excellent,"['Air conditioning', 'Spa', 'Free WiFi', 'Parking included', 'Laundry', 'Pool']","42 Geejgarh House Hawa Sadak, Jaipur, Rajasthan, 302006",Jodhpur,India,"26.901508, 75.783514",91.0
685,Royal Orchid Central Jaipur,3.8,Good,"['Air conditioning', 'Free WiFi', 'Parking included', 'Laundry', 'Pool', 'Restaurant']","A-26, A / 2, Jaisingh Highway, Bani Park, Jaipur, Rajasthan, 302016",Jodhpur,India,"26.897075, 75.81047",60.0
686,ibis Jaipur Civil Lines Hotel,3.9,Good,"['Air conditioning', 'Free WiFi', 'Parking included', 'Laundry', 'Pool', 'Restaurant']","Civil Lines Area, Ajmer Road, Near Civil Lines Metro Station, Jaipur, Rajasthan, 302006",Jodhpur,India,"26.90795, 75.779678",51.0
687,County Inn Hotel,4.0,Very Good,"['Air conditioning', 'Free WiFi', 'Parking included', 'Laundry', 'Restaurant', 'Room service']","268 Vaishali Marg, Nemi Sagar Colony, Hanuman Nagar, Jaipur, RJ, 302021",Jodhpur,India,"26.915164, 75.752316",96.0
688,Crimson Park - The Heritage,4.5,Wonderful,"['Air conditioning', 'Breakfast included', 'Free WiFi', 'Parking included', 'Laundry', 'Restaurant']","Amer Road, Near Jal Mahal, Jaipur, Rajasthan, 302001",Jodhpur,India,"26.949659, 75.841922",107.0
689,Hotel Cordon Vay,4.7,Exceptional,"['Air conditioning', 'Free WiFi', 'Parking included', 'Breakfast available', 'Housekeeping', '24/7 front desk']","B-31, Mahalakshmi Nagar, Behind WTP, JLN Marg, Jaipur, Rajasthan, 302017",Jodhpur,India,"26.852518, 75.805354",19.0
690,Hotel Royal Empire,4.8,Exceptional,"['Air conditioning', 'Free WiFi', 'Parking included', 'Laundry', 'Pool', 'Restaurant']","83,Girdhar Marg, JLN Marg,Near Fortis, Airport Zone, Jaipur, Rajasthan, 302017",Jodhpur,India,"26.84771, 75.8062",51.0
691,Hotel Royal Orchid,4.0,Very Good,"['Air conditioning', 'Free WiFi', 'Parking included', 'Laundry', 'Pool', 'Restaurant']","Opposite to BSNL Office, Tonk Road, Near Durgapura Flyover, Durgapura, Jaipur, Rajasthan, 302018",Jodhpur,India,"26.84485, 75.793496",66.0
692,Sanskar Prime Hotel,4.1,Wonderful,"['Air conditioning', 'Free WiFi', 'Parking included', 'Laundry', 'Restaurant', 'Breakfast available']","12-13, DCM, Ajmer Road, Jaipur, Rajasthan, 302021",Jodhpur,India,"26.890951, 75.742003",28.0
693,Khandwa Haveli,3.8,Very Good,"['Air conditioning', 'Free WiFi', 'Parking included', 'Laundry', 'Restaurant', 'Business services']","Ambabari, Sikar Road, Jaipur, Rajasthan, 302039",Jodhpur,India,"26.943982, 75.773508",62.0
694,Khas Bagh,4.5,Wonderful,"['Air conditioning', 'Spa', 'Free WiFi', 'Parking included', 'Laundry', 'Pet friendly']","Village Natata, Amer, Rajasthan, 302028",Jodhpur,India,"27.01501, 75.92018",86.0
695,Sarovar Portico Jaipur,4.0,Very Good,"['Air conditioning', 'Free WiFi', 'Parking included', 'Laundry', 'Pool', 'Restaurant']","Plot No 90,Bhan Nagar, Prince Road,Queens Road,Vaishali, Jaipur, Rajasthan, 302021",Jodhpur,India,"26.902716, 75.752208",107.0
696,Royal View Hotel,4.6,Exceptional,"['Air conditioning', 'Free WiFi', 'Parking included', 'Laundry', 'Restaurant', 'Breakfast available']","R-18, B.B. Fatima Colony, Ramgarh Moad, Jaipur, Rajasthan, 302002",Jodhpur,India,"26.946138, 75.847533",19.0
697,hotel S57,3.5,Good,"['Air conditioning', 'Free WiFi', 'Parking included', 'Laundry', 'Restaurant', 'Business services']","s57 shyam marg, adinath nagar, Jaipur, rajasthan, 302018",Jodhpur,India,"26.8517, 75.80149",32.0
698,Hotel Gandharva - A Green Hotel,3.7,Good,"['Free airport shuttle', 'Air conditioning', 'Free WiFi', 'Parking included', 'Laundry', 'Pool']","Station Road, Near Reserve Police Lines, Jaipur, Rajasthan, 302006",Jodhpur,India,"26.924609, 75.804699",45.0
699,Jaipur Hotel New,4.3,Excellent,"['Air conditioning', 'Spa', 'Free WiFi', 'Laundry', 'Restaurant', 'Breakfast available']","07- Film Colony, Jaipur, Rajasthan, 302002",Jodhpur,India,"26.917376, 75.820827",29.0
700,"Four Points by Sheraton Jaipur, City Square",4.0,Very Good,"['Air conditioning', 'Spa', 'Free WiFi', 'Parking included', 'Laundry', 'Pool']","City Square, Vasundhara Colony, Tonk Road, Jaipur, Rajasthan, 302018",Jodhpur,India,"26.863574, 75.796034",94.0
701,Treebo Trend Airport View,4.6,Exceptional,"['Spa', 'Breakfast included', 'Free WiFi', 'Parking included', 'Laundry', 'Restaurant']","Plot No.37 shreenath nagar,, opp. old airport, Janakpuri, Sanganer, Jaipur, Rajasthan, 302029",Jodhpur,India,"26.786587, 75.807605",24.0
702,Treebo Trend Hotel New Rockwell,4.1,Wonderful,"['Breakfast included', 'Free WiFi', 'Parking included', 'Restaurant', 'Housekeeping']","24, Hem Marg, Behind Reliance Fresh, Metro Piller No 98, New Sanganer Road, Jaipur, Rajasthan, 302019",Jodhpur,India,"26.891711, 75.769884",23.0
703,Hotel Vrisa,3.9,Very Good,"['Air conditioning', 'Free WiFi', 'Parking included', 'Laundry', 'Restaurant', 'Breakfast available']","12, Airport plaza, Durgapura, Tonk Road, Jaipur, Rajasthan, 302018",Jodhpur,India,"26.843117, 75.795562",55.0
704,Ramada by Wyndham Jaipur Jaisinghpura,4.0,Very Good,"['Hot Tub', 'Air conditioning', 'Free WiFi', 'Parking included', 'Laundry', 'Restaurant']","Jaisinghpura, Ajmer Road, Jaipur, Rajasthan, 302026",Jodhpur,India,"26.825265, 75.697893",63.0
705,Treebo Trend Resolute,4.4,Wonderful,"['Air conditioning', 'Free WiFi', 'Parking included', 'Laundry', 'Restaurant', 'Room service']","A1, Tonk Rd, near Glass Factory, Jawahar Nagar Colony, Bajaj Nagar, Jaipur, Rajasthan, 302018",Jodhpur,India,"26.868489, 75.797102",23.0
706,"Lords Plaza, Jaipur",3.5,Good,"['Free airport shuttle', 'Air conditioning', 'Free WiFi', 'Parking included', 'Laundry', 'Restaurant']","Suchna Kendra, Opposite SMS Hospital, Sawai Ram Singh Rd, Near Jaipur, Jaipur, Rajasthan, 302 001",Jodhpur,India,"26.908927, 75.815349",24.0
707,Hotel Rajlaxmi Palace,4.0,Very Good,"['Air conditioning', 'Free WiFi', 'Parking included', 'Laundry', 'Restaurant', 'Breakfast available']","Near Sanjivani Hospital, Jaipur, Rajasthan, 302019",Jodhpur,India,"26.891327, 75.771006",24.0
708,KK Royal Hotel & Convention Centre,3.5,Good,"['Air conditioning', 'Spa', 'Breakfast included', 'Free WiFi', 'Parking included', 'Laundry']","Amer Road, Amer, Rajasthan, 302028",Jodhpur,India,"26.990464, 75.864786",62.0
709,Hotel Istana Inn,3.6,Very Good,"['Air conditioning', 'Free WiFi', 'Parking included', 'Laundry', 'Restaurant', 'Breakfast available']","B-142, Vidyut Nagar B, Queens Road, Jaipur, Rajasthan, 302019",Jodhpur,India,"26.900312, 75.754684",23.0
710,Hotel Marigold Jaipur,3.6,Good,"['Air conditioning', 'Free WiFi', 'Parking included', 'Laundry', 'Pool', 'Restaurant']","IT 20, Sitapura Industrial Area, Near, Jaipur Exhibition & Convention Ctr, Jaipur, 302022",Jodhpur,India,"26.788386, 75.830676",187.0
711,Villa 243,3.7,Very Good,"['Air conditioning', 'Free WiFi', 'Parking included', 'Laundry', 'Pool', 'Restaurant']","243, Katewa Nagar, Vivek Vihar, Shyam Nagar, Jaipur, 302019",Jodhpur,India,"26.888372, 75.766082",669.0
712,Jasoda Heritage by Keshav Global Hotels,3.9,Very Good,"['Air conditioning', 'Free WiFi', 'Parking included', 'Laundry', 'Restaurant', 'Breakfast available']","Rochees Marg, J.D.A. Market, Behind Kale Ke Hanuman Ji Temple, Jaipur, Rajasthan, 302002",Jodhpur,India,"26.930058, 75.828328",24.0
713,Umaid Bhawan,3.8,Very Good,"['Parking included', 'Laundry', 'Pool', 'Restaurant', 'Housekeeping', 'Babysitting']","D1-2A Behind collectorate, Jaipur, Rajasthan, 302016",Jodhpur,India,"26.927819, 75.789031",91.0
714,Khatu Haveli,4.8,Exceptional,"['Air conditioning', 'Breakfast included', 'Free WiFi', 'Parking included', 'Laundry', 'Restaurant']","Uniyaron Ka Rasta, Chandpole Bazar, Jaipur, Rajasthan, 302001",Jodhpur,India,"26.929741, 75.811546",45.0
715,Le Méridien Jaipur Resort & Spa,4.3,Excellent,"['Air conditioning', 'Spa', 'Free WiFi', 'Parking included', 'Laundry', 'Pool']","Number 1, RIICO, Amer, Rajasthan, 302028",Jodhpur,India,"27.032676, 75.888939",162.0
716,Regenta Inn Jaipur,3.7,Very Good,"['Air conditioning', 'Free WiFi', 'Parking included', 'Laundry', 'Pool', 'Restaurant']","B-31 , Govind Marg, Near Baraf Khana Gossing, Jaipur, Rajasthan, 302004",Jodhpur,India,"26.901939, 75.836112",42.0
717,Arya Niwas,4.5,Wonderful,"['Air conditioning', 'Free WiFi', 'Parking included', 'Laundry', 'Restaurant', 'Breakfast available']","Sansar Chandra Road, Behind Amber Tower, Jaipur, Rajasthan, 302001",Jodhpur,India,"26.921054, 75.804644",28.0
718,Hotel The Livin,4.0,Very Good,"['Air conditioning', 'Free WiFi', 'Parking included', 'Laundry', 'Restaurant', 'Gym']","Plot no 17-18 Subhash Nagar, Shastri Nagar, Near Science Park, Jaipur, Rajasthan, 302016",Jodhpur,India,"26.939205, 75.79688",40.0
719,Rajputana Diaries,4.8,Exceptional,"['Air conditioning', 'Free WiFi', 'Parking included', 'Restaurant', 'Breakfast available', 'Room service']","Sawai Jai Singh Hwy, Jaipur, RJ, 302016",Jodhpur,India,"26.926727, 75.7905",15.0
720,Tara Niwas,4.5,Wonderful,"['Air conditioning', 'Free WiFi', 'Parking included', 'Laundry', 'Pet friendly', 'Restaurant']","B-22/B, Shiv Marg, Bani Park, Jaipur, Rajasthan, 302016",Jodhpur,India,"26.926963, 75.794872",19.0
721,Castle Kanota,3.9,Very Good,"['Air conditioning', 'Parking included', 'Laundry', 'Pool', 'Restaurant', 'Gym']","Ganesh Vihar Colony, Kanota, Agra Road, Jaipur, Jaipur, RJ, 303012",Jodhpur,India,"26.872086, 75.94959",92.0
722,OYO 35787 Hotel Lily Bay Prime,3.8,Very Good,"['Air conditioning', 'Breakfast included', 'Free WiFi', 'Parking included', 'Business services', 'Housekeeping']","C-303,Siddharth Nagar,Jawahar Circle, Sangam Clny, Chainpura, Jagatpura, Jaipur, Rajasthan, 302029",Jodhpur,India,"26.832667, 75.807771",61.0
723,Hotel The Grand Kukas,4.7,Exceptional,"['Air conditioning', 'Free WiFi', 'Parking included', 'Laundry', 'Restaurant', 'Breakfast available']","Plot no 67, Royal City, Jaipur-Delhi Highway, Jamwa Ramgarh, Rajasthan, 302028",Jodhpur,India,"27.048561, 75.905502",56.0
724,"Bara Bungalow Kalwar, Jaipur - A Rosakue Collection",4.0,Very Good,"['Air conditioning', 'Free WiFi', 'Parking included', 'Laundry', 'Pool', 'Restaurant']","Mundota Rd, Jaipur, Rajasthan, 303706",Jodhpur,India,"26.988415, 75.584973",128.0
725,Hotel Rock land By Tuma Hotels,3.8,Very Good,"['Free WiFi', 'Parking included', 'Restaurant', 'Breakfast available', 'Business services', 'Room service']","S-8, Shri Gopal Nagar, Gopalpura By-Pass, (Main Road), Jaipur, Rajasthan, 302019",Jodhpur,India,"26.877464, 75.772411",33.0
726,Cambay Grand,3.9,Very Good,"['Air conditioning', 'Spa', 'Free WiFi', 'Parking included', 'Laundry', 'Pool']","Sp -36B Riico Industrial Area, Delhi-Jaipur Highway, Amer, Rajasthan, 303101",Jodhpur,India,"27.031372, 75.895426",31.0
727,Devraj Niwas Boutique Hotel,4.0,Very Good,"['Air conditioning', 'Free WiFi', 'Parking included', 'Laundry', 'Pool', 'Restaurant']","Khasa Kothi Crossing, Bani Park, Jaipur, Rajasthan, 302016",Jodhpur,India,"26.921546, 75.793836",28.0
728,Hotel Marc Inn,4.0,Very Good,"['Air conditioning', 'Free WiFi', 'Parking included', 'Laundry', 'Restaurant', 'Breakfast available']","S-5, 6, Amrapali Circle, Vaishali Nagar, Jaipur, Rajasthan, 302021",Jodhpur,India,"26.911524, 75.742198",25.0
729,Milestone 251,4.7,Exceptional,"['Air conditioning', 'Spa', 'Free WiFi', 'Parking included', 'Laundry', 'Restaurant']","D 251, Devi Marg, Jaipur, Rajasthan, 302016",Jodhpur,India,"26.926655, 75.78987",26.0
730,Hotel Sarang Palace,3.8,Good,"['Air conditioning', 'Free WiFi', 'Parking included', 'Laundry', 'Restaurant', 'Breakfast available']","A-40, Subhash Nagar, Jaipur, Rajasthan, 302016",Jodhpur,India,"26.931789, 75.79339",22.0
731,Clarks Amer,3.5,Good,"['Air conditioning', 'Spa', 'Free WiFi', 'Parking included', 'Laundry', 'Pool']","Jawahar Lal Nehru Marg, Jaipur, Rajasthan, 302018",Jodhpur,India,"26.845953, 75.802419",334.0
732,Hotel Sumaditya,4.0,Very Good,"['Air conditioning', 'Free WiFi', 'Parking included', 'Laundry', 'Restaurant', 'Breakfast available']","A-16B, Sikar Road, Ambabari, Vidhyadhar Nagar, Jaipur, Rajasthan, 302039",Jodhpur,India,"26.94357, 75.773674",31.0
